{
  "schema_version": "gc.measurement.station-catalogue/v2",
  "measurement_version": "gc.measurement/v1",
  "description": "Authoritative station identity for the ADR-090 production-line measurement model. A station_id here is the identity; every value under aliases is a way some emitter or surface refers to it, never a competing identity. Successor to gc-station-catalogue-v1.json, which stays on disk unmodified as a published version: v2 adds the spotbugs, policy, and vale sub-gates (issue #1355) and never drops or renames a v1 id.",
  "alias_kinds": {
    "adr061_phase": "A phase string persisted on WorkflowPhaseEvent (ADR-061).",
    "adr036_stage": "A routing stage id from .ground-control.yaml routing.stages and the step-file stage_id frontmatter (ADR-036).",
    "issue_thread_marker": "A value written into a <!-- gc:phase --> marker on the issue thread (ADR-029).",
    "mcp_action": "A gc_implement_mechanical action name that instruments this entry.",
    "skill_step": "A SKILL step number. An ordinal in a document, never an identity.",
    "display_label": "Human-facing wording. Explicitly non-identity: renaming one is never a breaking contract change."
  },
  "stations": [
    {
      "station_id": "issue_branch_resolution",
      "title": "Issue and branch resolution",
      "inspects": "That the issue, its requirements, and a compliant branch resolve in the invocation checkout.",
      "aliases": {
        "adr036_stage": ["issue_branch_resolution"],
        "mcp_action": ["bootstrap"],
        "skill_step": ["Step 1"],
        "display_label": ["Issue & branch resolution"]
      }
    },
    {
      "station_id": "architecture_preflight",
      "title": "Architecture preflight",
      "inspects": "The proposed change against the repository's architecture, producing binding guardrails.",
      "aliases": {
        "adr061_phase": ["preflight"],
        "adr036_stage": ["architecture_preflight"],
        "issue_thread_marker": ["preflight"],
        "skill_step": ["Step 2.5"],
        "display_label": ["Architecture preflight"]
      }
    },
    {
      "station_id": "completion_gate",
      "title": "Completion gate",
      "inspects": "The configured completion command, the configured policy command, and the server-side quality gates. Composite: the spotbugs, policy, and vale child gates run underneath it and report their own verdicts separately, so this station's result is the boundary's own verdict rather than a roll-up of theirs.",
      "aliases": {
        "adr061_phase": ["completion_gate"],
        "adr036_stage": ["completion_gate"],
        "mcp_action": ["verify"],
        "skill_step": ["Step 6"],
        "display_label": ["Completion gate"]
      }
    },
    {
      "station_id": "spotbugs",
      "title": "SpotBugs",
      "inspects": "The compiled Java tree for bug patterns, read from the SpotBugs report the completion command already produced.",
      "aliases": {
        "adr061_phase": ["spotbugs"],
        "display_label": ["SpotBugs"]
      }
    },
    {
      "station_id": "policy",
      "title": "Repo policy",
      "inspects": "The diff against the repo-native ADR and workflow guardrails, returning structured Violation codes.",
      "aliases": {
        "adr061_phase": ["policy"],
        "display_label": ["Policy", "Repo policy"]
      }
    },
    {
      "station_id": "vale",
      "title": "Vale",
      "inspects": "Changed Markdown against the repository's prose style rules.",
      "aliases": {
        "adr061_phase": ["vale"],
        "display_label": ["Vale", "Prose lint"]
      }
    },
    {
      "station_id": "codex_review",
      "title": "Codex review",
      "inspects": "The pre-push diff for defects, returning structured findings.",
      "aliases": {
        "adr061_phase": ["codex_review"],
        "adr036_stage": ["review_cycle_1_consume", "review_fix_application"],
        "skill_step": ["Step 6.5"],
        "display_label": ["Codex review"]
      }
    },
    {
      "station_id": "test_quality_review",
      "title": "Test-quality review",
      "inspects": "Whether the diff's tests actually prove what they claim to prove.",
      "aliases": {
        "adr061_phase": ["test_quality_review"],
        "adr036_stage": ["test_quality_review"],
        "skill_step": ["Step 6.6"],
        "display_label": ["Test-quality review"]
      }
    },
    {
      "station_id": "precommit",
      "title": "Pre-commit boundary",
      "inspects": "The configured pre-commit hook set against the staged tree.",
      "aliases": {
        "adr061_phase": ["precommit"],
        "adr036_stage": ["precommit"],
        "skill_step": ["Step 5"],
        "display_label": ["Pre-commit"]
      }
    },
    {
      "station_id": "git_publish",
      "title": "Publish",
      "inspects": "Stage, pre-commit hooks, commit, push, and remote-base synchronization.",
      "aliases": {
        "adr036_stage": ["git_publish", "base_sync"],
        "mcp_action": ["publish"],
        "skill_step": ["Step 7", "Step 8", "Step 8.5"],
        "display_label": ["Publish"]
      }
    },
    {
      "station_id": "ci",
      "title": "Continuous integration",
      "inspects": "The repository's CI run for the pushed head commit.",
      "aliases": {
        "adr061_phase": ["ci"],
        "adr036_stage": ["ci_monitor", "final_ci_verify"],
        "skill_step": ["Step 10"],
        "display_label": ["CI"]
      }
    },
    {
      "station_id": "sonarcloud",
      "title": "SonarCloud",
      "inspects": "The SonarCloud quality gate and the repository's new-issue gate.",
      "aliases": {
        "adr061_phase": ["sonarcloud"],
        "adr036_stage": ["sonarcloud"],
        "skill_step": ["Step 11"],
        "display_label": ["SonarCloud", "Sonar"]
      }
    }
  ],
  "non_station_stages": [
    {
      "adr036_stage": "read_issue_context",
      "reason": "Consumes the already-fetched issue thread. Inspects nothing and records no durable transition."
    },
    {
      "adr036_stage": "codebase_assessment",
      "reason": "Agent exploration of existing coverage. Produces judgement, not a pass/fail verdict."
    },
    {
      "adr036_stage": "implementation",
      "reason": "The work being inspected, not an inspection of it."
    },
    {
      "adr036_stage": "clause_mapping",
      "reason": "Maps requirement clauses to artifacts. Its verdict surfaces through the completion gate rather than as its own station."
    },
    {
      "adr036_stage": "pr_body",
      "reason": "Body shape is enforced inside the render tool at construction time, not observed as a separate gate execution."
    }
  ],
  "lifecycle_markers": [
    {
      "marker_id": "plan",
      "title": "Plan published",
      "records": "The implementation plan was posted to the issue thread.",
      "aliases": {
        "adr036_stage": ["planning"],
        "issue_thread_marker": ["plan"],
        "skill_step": ["Step 4"],
        "display_label": ["Plan"]
      }
    },
    {
      "marker_id": "pre_merge",
      "title": "Pre-merge readiness recorded",
      "records": "The pre-merge readiness record was written.",
      "aliases": {
        "issue_thread_marker": ["pre_merge"],
        "display_label": ["Pre-merge"]
      }
    },
    {
      "marker_id": "ready_for_review",
      "title": "Ready for review",
      "records": "Every automated gate is green and the run is waiting on a human merge decision.",
      "aliases": {
        "adr036_stage": ["final_report"],
        "issue_thread_marker": ["ready_for_review"],
        "mcp_action": ["readiness"],
        "skill_step": ["Step 17"],
        "display_label": ["Ready for review"]
      }
    },
    {
      "marker_id": "post_merge",
      "title": "Post-merge phase entered",
      "records": "The linked pull request merged and post-merge reconciliation began.",
      "aliases": {
        "adr036_stage": ["transition_reconcile", "close_issue_after_merge"],
        "mcp_action": ["finalize"],
        "skill_step": ["Step 15", "Step 16", "Step 20"],
        "display_label": ["Post-merge"]
      }
    },
    {
      "marker_id": "traceability_reconciled",
      "title": "Traceability reconciled",
      "records": "The traceability graph was reconciled against the merged diff.",
      "aliases": {
        "adr061_phase": ["traceability_reconcile"],
        "issue_thread_marker": ["traceability_reconciled"],
        "display_label": ["Traceability reconciled"]
      }
    }
  ]
}
